{
  "embedder_id": "minilm-l6-golden",
  "labels": [
    "audio.volume.mute",
    "audio.volume.set",
    "reminder.task.create",
    "sys.oos"
  ],
  "oos_label": "sys.oos",
  "embedding_dim": 4,
  "weights": [
    [
      0.0,
      0.1,
      0.2,
      0.3
    ],
    [
      0.1,
      0.2,
      0.3,
      0.4
    ],
    [
      0.2,
      0.3,
      0.4,
      0.5
    ],
    [
      0.3,
      0.4,
      0.5,
      0.6
    ]
  ],
  "bias": [
    0.0,
    0.0,
    0.0,
    0.0
  ]
}
